Main Topic,Subtopic Level 1,Subtopic Level 2,Details
"","18.4 Implicit Differentiation in 3D (Conceptual)","Surfaces defined by F(x,y,z) = 0","Partial derivatives preview"
"","","Multivariable calculus connection","Tangent planes to surfaces"
"","","Beyond AP Calculus BC scope (awareness only)",""
"19. Higher-Order Derivatives with Chain Rule","19.1 Second Derivatives of Compositions","Finding f''(x) when f is a composition","Applying product rule to f'(x) from chain rule"
"","","Examples: second derivative of sin(x²)","Complexity increase"
"","","Organization strategies",""
"","19.2 Product and Quotient of Compositions","Second derivatives of products involving compositions","Second derivatives of quotients involving compositions"
"","","Multiple rules combined repeatedly","Simplification challenges"
"","","When to stop simplifying",""
"","19.3 Higher-Order Derivatives Implicitly","Finding d²y/dx², d³y/dx³ from implicit equations","Recursive application of implicit differentiation"
"","","Substituting previous derivatives","Expressing in terms of x and y"
"","","Theoretical importance",""
"20. Hyperbolic Functions (if covered)","20.1 Hyperbolic Function Definitions","sinh(x) = (e^x - e^(-x))/2","cosh(x) = (e^x + e^(-x))/2"
"","","tanh(x) = sinh(x)/cosh(x)","Other hyperbolic functions"
"","","Relationship to exponentials",""
"","20.2 Derivatives of Hyperbolic Functions","d/dx[sinh(x)] = cosh(x)","d/dx[cosh(x)] = sinh(x)"
"","","d/dx[tanh(x)] = sech²(x)","Patterns similar to trig functions (but signs differ)"
"","","Memorization strategies",""
"","20.3 Chain Rule with Hyperbolic Functions","d/dx[sinh(u)] = cosh(u)·u'","Examples with various inner functions"
"","","Applications (catenary curve, etc.)","Less common in AP Calculus BC"
"","","Connection to complex numbers (advanced)",""
"21. Problem-Solving Strategies for Unit 3","21.1 Identifying Which Technique to Use","Chain rule indicators: composition of functions","Implicit differentiation: equation relating x and y"
"","","Logarithmic differentiation: products, quotients, variable exponents","Inverse functions: finding derivatives of inverses"
"","","Decision tree for method selection",""
"","21.2 Common Errors and How to Avoid Them","Forgetting to apply chain rule","Forgetting dy/dx in implicit differentiation"
"","","Sign errors (especially with inverse trig and trig derivatives)","Incorrectly identifying inner/outer functions"
"","","Algebraic errors in solving for dy/dx",""
"","21.3 Systematic Approach to Complex Problems","Read problem carefully","Identify all techniques needed"
"","","Plan order of operations","Execute step-by-step with clear notation"
"","","Check answer for reasonableness","Verify with specific values if possible"
"","21.4 Organizing Work Clearly","Using proper notation throughout","Showing all steps, especially for chain rule"
"","","Clear substitution and simplification","Labeling intermediate results"
"","","Final answer clearly indicated",""
"","21.5 Checking Your Work","Dimensional analysis (units make sense)","Special cases (e.g., x = 0, x = 1)"
"","","Graphical verification when possible","Plugging into original equation (implicit)"
"","","Alternative methods to verify",""
"22. Unit 3 Skills Summary","22.1 Core Skills from Unit 3","Apply chain rule to all function types","Perform implicit differentiation"
"","","Find derivatives of inverse functions","Use logarithmic differentiation"
"","","Differentiate parametric equations","Find derivatives of inverse trig functions"
"","","Combine multiple differentiation techniques",""
"","22.2 Conceptual Understanding Goals","Why chain rule is necessary","How implicit differentiation works"
"","","Relationship between function and inverse derivatives","When to use which technique"
"","","Connection between different methods",""
"","22.3 Preparation for Unit 4","Related rates (implicit + chain rule)","Optimization (finding critical points)"
"","","Applied problems requiring all techniques","Complex modeling situations"
"","","Building problem-solving toolkit",""
"","22.4 Connection to AP Exam","Chain rule appears throughout exam","Implicit differentiation common in FRQ"
"","","Inverse trig derivatives in integration","Parametric equations in BC-specific questions"
"","","Multiple techniques in single problem",""
